{
  "$schema": "https://json-schema.org/draft/2020-12/schema",
  "$id": "https://cosmic-vikings/ar-agent/contracts/calculation-result.schema.json",
  "title": "CalculationResult",
  "description": "Output of a financial calculation (match, reconcile, aging, rounding). Produced by ar_match_payments / ar_reconcile / ar_reporting.",
  "x-contract-version": "1.0.0",
  "x-status": "draft",
  "x-since": "2026-07-06",
  "type": "object",
  "additionalProperties": false,
  "required": ["trace_id", "tenant", "calculation_type", "totals", "line_items", "currency", "contract_version"],
  "properties": {
    "trace_id": {"type": "string", "minLength": 1},
    "tenant": {"type": "string", "minLength": 1},
    "calculation_type": {"type": "string", "enum": ["match", "reconcile", "aging", "rounding"]},
    "totals": {
      "type": "object",
      "additionalProperties": {"type": "string", "pattern": "^-?\\d+\\.\\d{2}$"},
      "minProperties": 1,
      "description": "Keys vary by calculation_type: e.g. matched/outstanding/posted (match, reconcile); bucket totals (aging); rounding_adjustment (rounding)."
    },
    "line_items": {
      "type": "array",
      "items": {"$ref": "#/$defs/line_item"}
    },
    "currency": {"type": "string", "pattern": "^[A-Z]{3}$"},
    "inputs_ref": {"type": "string", "minLength": 1, "description": "Reference to the input manifest/data used (e.g. manifest_id)."},
    "computed_at": {"type": "string", "pattern": "^\\d{4}-\\d{2}-\\d{2}T\\d{2}:\\d{2}:\\d{2}Z$"},
    "rounding_adjustment": {"type": "string", "pattern": "^-?\\d+\\.\\d{2}$", "description": "Net rounding applied to balance against the source-of-record total (signed)."},
    "contract_version": {"type": "string", "pattern": "^\\d+\\.\\d+\\.\\d+$"}
  },
  "$defs": {
    "line_item": {
      "type": "object",
      "additionalProperties": false,
      "required": ["label", "amount", "source_refs"],
      "properties": {
        "label": {"type": "string", "minLength": 1, "description": "e.g. matched:INV-123:RCT-456."},
        "amount": {"type": "string", "pattern": "^-?\\d+\\.\\d{2}$"},
        "source_refs": {
          "type": "array",
          "minItems": 1,
          "items": {"type": "string", "minLength": 1},
          "description": "Source document ids that produced this line (invoice/payment/receipt refs)."
        }
      }
    }
  }
}